{
  "clockQuality": "SYNCED",
  "commandUid": "30000000-0000-4000-8000-000000000003",
  "deliveryClass": "RELIABLE_FACT",
  "deploymentCode": "Dp_demo_01",
  "edgeEventSequence": 1042,
  "eventType": "DELIVERY_COMPLETE",
  "eventUid": "30000000-0000-4000-8000-000000000006",
  "occurredAt": "2026-07-24T01:00:30.000Z",
  "payload": {
    "completionReason": "USER_ENDED",
    "deliveryNetWeightGrams": 1250,
    "finalDoorCommand": {
      "command": "CLOSE",
      "outputStatus": "COMMAND_DISPATCHED",
      "physicalStateBasis": "NOT_OBSERVABLE"
    },
    "finalPostCloseMeasurement": {
      "calibrationVersion": 4,
      "faultCode": null,
      "mcuBootId": 101,
      "mcuEventSequence": 29,
      "measurementElapsedMs": 1200,
      "measurementUid": "30000000-0000-4000-8000-000000000005",
      "reportedWeightGrams": 13250,
      "sampleCount": 12,
      "sensorHealth": "OK",
      "status": "STABLE",
      "weightValueAvailable": true,
      "weightValueKind": "STABLE_WINDOW_MEAN"
    },
    "firstPreOpenMeasurement": {
      "calibrationVersion": 4,
      "faultCode": null,
      "mcuBootId": 101,
      "mcuEventSequence": 11,
      "measurementElapsedMs": 1200,
      "measurementUid": "30000000-0000-4000-8000-000000000004",
      "reportedWeightGrams": 12000,
      "sampleCount": 12,
      "sensorHealth": "OK",
      "status": "STABLE",
      "weightValueAvailable": true,
      "weightValueKind": "STABLE_WINDOW_MEAN"
    },
    "frozenConfig": {
      "contentSha256": "aaaaaaaaaaaaaaaaaaaaaaaaaaaaaaaaaaaaaaaaaaaaaaaaaaaaaaaaaaaaaaaa",
      "mcuPayloadSha256": "bbbbbbbbbbbbbbbbbbbbbbbbbbbbbbbbbbbbbbbbbbbbbbbbbbbbbbbbbbbbbbbb",
      "version": 8
    },
    "manualReviewRequired": false,
    "negativeWeightAnomaly": false,
    "photos": [
      {
        "capturedAt": null,
        "missingReason": "CAMERA_NOT_READY",
        "photoUid": null,
        "sha256": null,
        "sizeBytes": null,
        "slot": "BEFORE_INNER",
        "status": "UPLOAD_PENDING",
        "url": null
      },
      {
        "capturedAt": null,
        "missingReason": "CAMERA_NOT_READY",
        "photoUid": null,
        "sha256": null,
        "sizeBytes": null,
        "slot": "BEFORE_OUTER",
        "status": "UPLOAD_PENDING",
        "url": null
      },
      {
        "capturedAt": null,
        "missingReason": "CAMERA_NOT_READY",
        "photoUid": null,
        "sha256": null,
        "sizeBytes": null,
        "slot": "AFTER_INNER",
        "status": "UPLOAD_PENDING",
        "url": null
      },
      {
        "capturedAt": null,
        "missingReason": "CAMERA_NOT_READY",
        "photoUid": null,
        "sha256": null,
        "sizeBytes": null,
        "slot": "AFTER_OUTER",
        "status": "UPLOAD_PENDING",
        "url": null
      }
    ],
    "portNo": 2,
    "sessionUid": "30000000-0000-4000-8000-000000000001",
    "unitPriceTenThousandths": 4500
  },
  "payloadSha256": "427ffe8ec4d4c6ec17729339142da80b86521b8dc37930f23ae998f8da7b2d01",
  "schemaVersion": 1,
  "target": {
    "type": "DELIVERY_SESSION",
    "uid": "30000000-0000-4000-8000-000000000001"
  }
}
