{
  "clockQuality": "SYNCED",
  "commandUid": "30000000-0000-4000-8000-000000000003",
  "deliveryClass": "RELIABLE_FACT",
  "deploymentCode": "Dp_demo_01",
  "edgeEventSequence": 1046,
  "eventType": "DEVICE_COMMAND_OBSERVED",
  "eventUid": "84000000-0000-4000-8000-000000000001",
  "occurredAt": "2026-07-24T01:00:30.000Z",
  "payload": {
    "errorCode": null,
    "mcuCommandUid": "84000000-0000-4000-8000-000000000002",
    "observedCommandType": "START_DELIVERY_SESSION",
    "stage": "MCU_ACCEPTED"
  },
  "payloadSha256": "e693e48114cfcb69b849750fc8740ad26fe8afdf8b391a591e39a80f2ee0efe5",
  "schemaVersion": 1,
  "target": {
    "type": "DEVICE_COMMAND",
    "uid": "30000000-0000-4000-8000-000000000003"
  }
}
