{
  "clockQuality": "SYNCED",
  "commandUid": "82000000-0000-4000-8000-000000000002",
  "deliveryClass": "RELIABLE_FACT",
  "deploymentCode": "Dp_demo_01",
  "edgeEventSequence": 1048,
  "eventType": "BASELINE_MEASUREMENT_COMPLETE",
  "eventUid": "86000000-0000-4000-8000-000000000001",
  "occurredAt": "2026-07-24T01:00:30.000Z",
  "payload": {
    "bagUid": "40000000-0000-4000-8000-000000000002",
    "emptyBagConfirmed": true,
    "frozenConfig": {
      "contentSha256": "aaaaaaaaaaaaaaaaaaaaaaaaaaaaaaaaaaaaaaaaaaaaaaaaaaaaaaaaaaaaaaaa",
      "mcuPayloadSha256": "bbbbbbbbbbbbbbbbbbbbbbbbbbbbbbbbbbbbbbbbbbbbbbbbbbbbbbbbbbbbbbbb",
      "version": 8
    },
    "measurementUid": "82000000-0000-4000-8000-000000000001",
    "portNo": 2,
    "totalWeightMeasurement": {
      "calibrationVersion": 4,
      "faultCode": null,
      "mcuBootId": 101,
      "mcuEventSequence": 47,
      "measurementElapsedMs": 1200,
      "measurementUid": "86000000-0000-4000-8000-000000000002",
      "reportedWeightGrams": 1180,
      "sampleCount": 12,
      "sensorHealth": "OK",
      "status": "STABLE",
      "weightValueAvailable": true,
      "weightValueKind": "STABLE_WINDOW_MEAN"
    }
  },
  "payloadSha256": "c0806bd4cd56f5cc8ecd480cbf4dc277687f7104ce07f8b1555bd18a451e87c8",
  "schemaVersion": 1,
  "target": {
    "type": "BASELINE_MEASUREMENT",
    "uid": "82000000-0000-4000-8000-000000000001"
  }
}
