{
  "clockQuality": "SYNCED",
  "commandUid": "50000000-0000-4000-8000-000000000004",
  "deliveryClass": "RELIABLE_FACT",
  "deploymentCode": "Dp_demo_01",
  "edgeEventSequence": 1044,
  "eventType": "FULLNESS_SAMPLE_COMPLETE",
  "eventUid": "50000000-0000-4000-8000-000000000003",
  "occurredAt": "2026-07-24T01:00:30.000Z",
  "payload": {
    "detectionUid": "50000000-0000-4000-8000-000000000001",
    "frozenConfig": {
      "contentSha256": "aaaaaaaaaaaaaaaaaaaaaaaaaaaaaaaaaaaaaaaaaaaaaaaaaaaaaaaaaaaaaaaa",
      "mcuPayloadSha256": "bbbbbbbbbbbbbbbbbbbbbbbbbbbbbbbbbbbbbbbbbbbbbbbbbbbbbbbbbbbbbbbb",
      "version": 8
    },
    "fullnessMode": "SENSOR_OR_WEIGHT",
    "fullnessSampleBasis": "MEASURED_MEDIAN",
    "fullnessSensorKind": "ULTRASONIC",
    "fullnessSensorValue": "CLEAR",
    "portNo": 2,
    "representativeDistanceMm": 720,
    "requestedSampleCount": 5,
    "sampleRole": "INITIAL",
    "totalWeightMeasurement": {
      "calibrationVersion": 4,
      "faultCode": null,
      "mcuBootId": 101,
      "mcuEventSequence": 45,
      "measurementElapsedMs": 1200,
      "measurementUid": "50000000-0000-4000-8000-000000000002",
      "reportedWeightGrams": 13250,
      "sampleCount": 12,
      "sensorHealth": "OK",
      "status": "STABLE",
      "weightValueAvailable": true,
      "weightValueKind": "STABLE_WINDOW_MEAN"
    },
    "triggerType": "DELIVERY_COMPLETE",
    "validSampleCount": 5
  },
  "payloadSha256": "9186f31e3b33a9380dfe1a437f4a132c65499c7639699e443679e8b329b39213",
  "schemaVersion": 1,
  "target": {
    "type": "FULLNESS_DETECTION",
    "uid": "50000000-0000-4000-8000-000000000001"
  }
}
