{
  "clockQuality": "SYNCED",
  "commandUid": null,
  "deliveryClass": "RELIABLE_FACT",
  "deploymentCode": "Dp_demo_01",
  "edgeEventSequence": 1050,
  "eventType": "DEVICE_FAULT_RECOVERED",
  "eventUid": "87000000-0000-4000-8000-000000000003",
  "occurredAt": "2026-07-24T01:00:30.000Z",
  "payload": {
    "component": "WEIGHT_SENSOR",
    "faultCode": "WEIGHT_SENSOR",
    "faultUid": "87000000-0000-4000-8000-000000000001",
    "mcuBootId": 101,
    "mcuEventSequence": 49,
    "portNo": 2,
    "severity": "BLOCK_PORT"
  },
  "payloadSha256": "a96e6ac4a21a05366b2a44544832f3890b5e12579188c36e902c4a949d9f013a",
  "schemaVersion": 1,
  "target": {
    "type": "DEVICE_DEPLOYMENT",
    "uid": "Dp_demo_01"
  }
}
