{
  "clockQuality": "SYNCED",
  "commandUid": null,
  "deliveryClass": "TELEMETRY_SNAPSHOT",
  "deploymentCode": "Dp_demo_01",
  "edgeEventSequence": 1053,
  "eventType": "DEVICE_RUNTIME_SNAPSHOT",
  "eventUid": "89000000-0000-4000-8000-000000000001",
  "occurredAt": "2026-07-24T01:00:30.000Z",
  "payload": {
    "appliedConfig": {
      "contentSha256": "aaaaaaaaaaaaaaaaaaaaaaaaaaaaaaaaaaaaaaaaaaaaaaaaaaaaaaaaaaaaaaaa",
      "mcuPayloadSha256": "bbbbbbbbbbbbbbbbbbbbbbbbbbbbbbbbbbbbbbbbbbbbbbbbbbbbbbbbbbbbbbbb",
      "version": 8
    },
    "capabilityBitmapHex": "0000000000001fff",
    "clockState": "SYNCED",
    "edgeBootId": 9001,
    "edgeVersion": "1.0.0-rc.3",
    "localStorageState": "HEALTHY",
    "mcuBootId": 101,
    "mcuFirmwareVersion": "1.0.0-rc.3",
    "pendingReliableEventCount": 2,
    "ports": [
      {
        "calibrationVersion": 4,
        "cleanDoorStateBasis": "NOT_OBSERVABLE",
        "cleanLockPowerState": "DEENERGIZED",
        "cleanerPhysicalCloseConfirmed": false,
        "deliveryDoorPhysicalStateBasis": "NOT_OBSERVABLE",
        "faultBitmap": 0,
        "fullnessSampleBasis": "MEASURED_MEDIAN",
        "fullnessSensorKind": "ULTRASONIC",
        "fullnessSensorValue": "CLEAR",
        "fullnessValidSampleCount": 5,
        "lastDeliveryDoorCommand": "CLOSE",
        "lastDeliveryDoorOutputStatus": "COMMAND_DISPATCHED",
        "measurementElapsedMs": 1200,
        "portNo": 1,
        "reportedWeightGrams": 13250,
        "representativeDistanceMm": 720,
        "smokeSensorHealth": "OK",
        "smokeState": "NORMAL",
        "solenoidHealth": "OK",
        "weightFaultCode": null,
        "weightMcuBootId": 101,
        "weightMcuEventSequence": 51,
        "weightMeasurementStatus": "STABLE",
        "weightMeasurementUid": "89500000-0000-4000-8000-000000000001",
        "weightSampleCount": 12,
        "weightSensorHealth": "OK",
        "weightValueAvailable": true,
        "weightValueKind": "STABLE_WINDOW_MEAN"
      },
      {
        "calibrationVersion": 4,
        "cleanDoorStateBasis": "NOT_OBSERVABLE",
        "cleanLockPowerState": "DEENERGIZED",
        "cleanerPhysicalCloseConfirmed": false,
        "deliveryDoorPhysicalStateBasis": "NOT_OBSERVABLE",
        "faultBitmap": 0,
        "fullnessSampleBasis": "MEASURED_MEDIAN",
        "fullnessSensorKind": "ULTRASONIC",
        "fullnessSensorValue": "CLEAR",
        "fullnessValidSampleCount": 5,
        "lastDeliveryDoorCommand": "CLOSE",
        "lastDeliveryDoorOutputStatus": "COMMAND_DISPATCHED",
        "measurementElapsedMs": 1200,
        "portNo": 2,
        "reportedWeightGrams": 13250,
        "representativeDistanceMm": 720,
        "smokeSensorHealth": "OK",
        "smokeState": "NORMAL",
        "solenoidHealth": "OK",
        "weightFaultCode": null,
        "weightMcuBootId": 101,
        "weightMcuEventSequence": 52,
        "weightMeasurementStatus": "STABLE",
        "weightMeasurementUid": "89500000-0000-4000-8000-000000000002",
        "weightSampleCount": 12,
        "weightSensorHealth": "OK",
        "weightValueAvailable": true,
        "weightValueKind": "STABLE_WINDOW_MEAN"
      }
    ],
    "uartProtocolMajor": 1,
    "uartProtocolMinor": 0,
    "uartState": "READY"
  },
  "payloadSha256": "754c170c8b901684d2640ff0c2573e06725a700edfc753ebcce7cbe5810edf23",
  "schemaVersion": 1,
  "target": {
    "type": "DEVICE_DEPLOYMENT",
    "uid": "Dp_demo_01"
  }
}
